fue02-34|pero un toldo tiene tantos poros, que nada pude descubrir.|pero un toldo tiene tantos poros, que nada pude descubrir.
fue02-35|En el comedor me esperaba un almuerzo admirable;|En el comedor me esperaba un almuerzo admirable;
fue02-36|pues mi afortunado celibato sabía dos cosas sobre todo:|pues mi afortunado celibato sabia dos cosas sobre todo:
fue02-37|leer y comer.|leer y comer.
fue02-38|Excepto la biblioteca, el comedor era mi orgullo.|Excepto la biblioteca, el comedor era mi orgullo.
fue02-39|Ahíto de mujeres y un poco gotoso, en punto a vicios amables nada podía esperar ya sino de la gula.|Ahito de mujeres y un poco gotoso, en punto a vicios amables nada podia esperar ya sino de la gula.
fue02-40|Comía solo, mientras un esclavo me leía narraciones geográficas.|Comia solo, mientras un esclavo me leia narraciones geograficas.
fue02-41|Nunca había podido comprender las comidas en compañía;|Nunca habia podido comprender las comidas en compania;
fue02-42|y si las mujeres me hastiaban, como he dicho, ya comprenderéis que aborrecía a los hombres.|y si las mujeres me hastiaban, como he dicho, ya comprendereis que aborrecia a los hombres.
fue02-43|¡Diez años me separaban de mi última orgía! Desde entonces, entregado a mis jardines,|!Diez anos me separaban de mi ultima orgia! Desde entonces, entregado a mis jardines,
fue02-44|a mis peces, a mis pájaros, faltábame tiempo para salir.|a mis peces, a mis pajaros, faltabame tiempo para salir.
fue02-45|Alguna vez, en las tardes muy calurosas, un paseo a la orilla del lago.|Alguna vez, en las tardes muy calurosas, un paseo a la orilla del lago.
fue02-46|Me gustaba verlo, escamado de luna al anochecer, pero esto era todo y pasaba meses sin frecuentarlo.|Me gustaba verlo, escamado de luna al anochecer, pero esto era todo y pasaba meses sin frecuentarlo.
fue02-47|La vasta ciudad libertina era para mí un desierto donde se refugiaban mis placeres.|La vasta ciudad libertina era para mi un desierto donde se refugiaban mis placeres.
fue02-48|Escasos amigos; breves visitas; largas horas de mesa;|Escasos amigos; breves visitas; largas horas de mesa;
fue02-49|lecturas; mis peces; mis pájaros;|lecturas; mis peces; mis pajaros;
fue02-50|una que otra noche tal cual orquesta de flautistas, y dos o tres ataques de gota por año…|una que otra noche tal cual orquesta de flautistas, y dos o tres ataques de gota por ano...
fue02-51|Tenía el honor de ser consultado para los banquetes, y por ahí figuraban, no sin elogio,|Tenia el honor de ser consultado para los banquetes, y por ahi figuraban, no sin elogio,
fue02-52|dos o tres salsas de mi invención.|dos o tres salsas de mi invencion.
fue02-53|Esto me daba derecho —lo digo sin orgullo— a un busto municipal,|Esto me daba derecho --lo digo sin orgullo-- a un busto municipal,
fue02-54|con tanta razón como a la compatriota que acababa de inventar un nuevo beso.|con tanta razon como a la compatriota que acababa de inventar un nuevo beso.
fue02-55|Entre tanto, mi esclavo leía.|Entre tanto, mi esclavo leia.
fue02-56|Leía narraciones de mar y de nieve, que comentaban admirablemente,|Leia narraciones de mar y de nieve, que comentaban admirablemente,
fue02-57|en la ya entrada siesta, el generoso frescor de las ánforas.|en la ya entrada siesta, el generoso frescor de las anforas.
fue02-58|La lluvia de fuego había cesado quizá, pues la servidumbre no daba muestras de notarla.|La lluvia de fuego habia cesado quiza, pues la servidumbre no daba muestras de notarla.
fue02-59|De pronto, el esclavo que atravesaba el jardín con un nuevo plato no pudo reprimir un grito.|De pronto, el esclavo que atravesaba el jardin con un nuevo plato no pudo reprimir un grito.
fue02-60|Llegó, no obstante, a la mesa;|Llego, no obstante, a la mesa;
fue02-61|pero acusando con su lividez un dolor horrible.|pero acusando con su lividez un dolor horrible.
fue02-62|Tenía en su desnuda espalda un agujerillo, en cuyo fondo|Tenia en su desnuda espalda un agujerillo, en cuyo fondo
fue02-63|sentíase chirriar aún la chispa voraz que lo había abierto.|sentiase chirriar aun la chispa voraz que lo habia abierto.
fue02-64|Ahogámosla en aceite, y fue enviado al lecho sin que pudiera contener sus ayes.|Ahogamosla en aceite, y fue enviado al lecho sin que pudiera contener sus ayes.
fue02-65|Bruscamente acabó mí apetito;|Bruscamente acabo mi apetito;
fue02-66|y aunque seguí probando los platos para no desmoralizar a la servidumbre, aquélla se apresuró a comprenderme.|y aunque segui probando los platos para no desmoralizar a la servidumbre, aquella se apresuro a comprenderme.
fue02-67|El incidente me había desconcertado.|El incidente me habia desconcertado.
fue02-68|Promediaba la siesta cuando subí nuevamente a la terraza.|Promediaba la siesta cuando subi nuevamente a la terraza.
fue02-69|El suelo estaba ya sembrado de gránulos de cobre;|El suelo estaba ya sembrado de granulos de cobre;
fue02-70|mas no parecía que la lluvia aumentara.|mas no parecia que la lluvia aumentara.
fue02-71|Comenzaba a tranquilizarme, cuando una nueva inquietud me sobrecogió.|Comenzaba a tranquilizarme, cuando una nueva inquietud me sobrecogio.
fue02-72|El silencio era absoluto.|El silencio era absoluto.
fue02-73|El tráfico estaba paralizado a causa del fenómeno, sin duda.|El trafico estaba paralizado a causa del fenomeno, sin duda.
fue02-74|Ni un rumor en la ciudad.|Ni un rumor en la ciudad.
fue02-75|Sólo, de cuando en cuando, un vago murmullo de viento sobre los árboles.|Solo, de cuando en cuando, un vago murmullo de viento sobre los arboles.
fue02-76|Era también alarmante la actitud de los pájaros.|Era tambien alarmante la actitud de los pajaros.
fue02-77|Habíanse apelotonado en un rincón casi unos sobre otros.|Habianse apelotonado en un rincon casi unos sobre otros.
fue02-78|Me dieron compasión y decidí abrirles la puerta.|Me dieron compasion y decidi abrirles la puerta.
fue02-79|No quisieron salir;|No quisieron salir;
fue02-80|antes se recogieron más acongojados aún.|antes se recogieron mas acongojados aun.
fue02-81|Entonces comenzó a intimidarme la idea de un cataclismo.|Entonces comenzo a intimidarme la idea de un cataclismo.
fue02-82|Sin ser grande mi erudición científica, sabía que nadie mencionó jamás esas lluvias de cobre incandescente.|Sin ser grande mi erudicion cientifica, sabia que nadie menciono jamas esas lluvias de cobre incandescente.
fue02-83|¡Lluvias de cobre! En el aire no hay minas de cobre.|!Lluvias de cobre! En el aire no hay minas de cobre.
fue02-84|Luego aquella limpidez del cielo no dejaba conjeturar la procedencia.|Luego aquella limpidez del cielo no dejaba conjeturar la procedencia.
fue02-85|Y lo alarmante del fenómeno era esto.|Y lo alarmante del fenomeno era esto.
fue02-86|Las chispas venían de todas partes y de ninguna.|Las chispas venian de todas partes y de ninguna.
fue02-87|Era la inmensidad desmenuzándose invisiblemente en fuego.|Era la inmensidad desmenuzandose invisiblemente en fuego.
fue02-88|Caía del firmamento el terrible cobre; pero el firmamento permanecía impasible en su azul.|Caia del firmamento el terrible cobre; pero el firmamento permanecia impasible en su azul.
fue02-89|Ganábame poco a poco una extraña congoja;|Ganabame poco a poco una extrana congoja;
fue02-90|pero, cosa rara:|pero, cosa rara:
fue02-91|hasta entonces no había pensado en huir.|hasta entonces no habia pensado en huir.
fue02-92|Esta idea se mezcló con desagradables interrogaciones.|Esta idea se mezclo con desagradables interrogaciones.
fue02-93|¡Huir! ¿Y mi mesa, mis libros, mis pájaros,|!Huir! ?Y mi mesa, mis libros, mis pajaros,
fue02-94|mis peces que acababan precisamente de estrenar un vivero,|mis peces que acababan precisamente de estrenar un vivero,
fue02-95|mis jardines ya ennoblecidos de antigüedad,|mis jardines ya ennoblecidos de antiguedad,
fue02-96|mis cincuenta años de placidez, en la dicha del presente, en el descuido del mañana…?|mis cincuenta anos de placidez, en la dicha del presente, en el descuido del manana...?
fue02-97|¿Huir…? Y pensé con horror en mis posesiones (que no conocía) del otro lado del desierto,|?Huir...? Y pense con horror en mis posesiones (que no conocia) del otro lado del desierto,
fue02-98|con sus camelleros viviendo en tiendas de lana negra y tomando por todo alimento leche cuajada,|con sus camelleros viviendo en tiendas de lana negra y tomando por todo alimento leche cuajada,
fue02-99|trigo tostado, miel agria…|trigo tostado, miel agria...
fue02-100|Quedaba una fuga por el lago, corta fuga después de todo,|Quedaba una fuga por el lago, corta fuga despues de todo,
fue02-101|si en el lago como en el desierto, según era lógico, llovía cobre también;|si en el lago como en el desierto, segun era logico, llovia cobre tambien;
fue02-102|pues no viniendo aquello de ningún foco visible, debía de ser general.|pues no viniendo aquello de ningun foco visible, debia de ser general.
fue02-103|No obstante el vago terror que me alarmaba, decíame todo eso claramente,|No obstante el vago terror que me alarmaba, deciame todo eso claramente,
fue02-104|lo discutía conmigo mismo, un poco enervado a la verdad por el letargo digestivo de mi siesta consuetudinaria.|lo discutia conmigo mismo, un poco enervado a la verdad por el letargo digestivo de mi siesta consuetudinaria.
fue02-105|Y después de todo, algo me decía que el fenómeno no iba a pasar de allí.|Y despues de todo, algo me decia que el fenomeno no iba a pasar de alli.
fue02-106|Sin embargo, nada se perdía con hacer armar el carro.|Sin embargo, nada se perdia con hacer armar el carro.
fue02-107|En ese momento llenó el aire una vasta vibración de campanas.|En ese momento lleno el aire una vasta vibracion de campanas.
fue02-108|Y casi junto con ella advertí una cosa: ya no llovía cobre.|Y casi junto con ella adverti una cosa: ya no llovia cobre.
fue02-109|El repique era una acción de gracias, coreada casi acto continuo por el murmullo habitual de la ciudad.|El repique era una accion de gracias, coreada casi acto continuo por el murmullo habitual de la ciudad.
fue02-110|Esta despertaba de su fugaz atonía, doblemente gárrula.|Esta despertaba de su fugaz atonia, doblemente garrula.
fue02-111|En algunos barrios hasta quemaban petardos.|En algunos barrios hasta quemaban petardos.
fue02-112|Acodado al parapeto de la terraza,|Acodado al parapeto de la terraza,
fue02-113|miraba con un desconocido bienestar solidario la animación vespertina que era todo amor y lujo.|miraba con un desconocido bienestar solidario la animacion vespertina que era todo amor y lujo.
fue02-114|El cielo seguía purísimo.|El cielo seguia purisimo.
fue02-115|Muchachos afanosos recogían en escudillas la granalla de cobre, que los caldereros habían empezado a comprar.|Muchachos afanosos recogian en escudillas la granalla de cobre, que los caldereros habian empezado a comprar.
fue02-116|Era todo cuanto quedaba de la grande amenaza celeste.|Era todo cuanto quedaba de la grande amenaza celeste.
fue02-117|Más numerosa que nunca, la gente de placer coloría las calles;|Mas numerosa que nunca, la gente de placer coloria las calles;
fue02-118|y aun recuerdo que sonreí vagamente a un equívoco mancebo,|y aun recuerdo que sonrei vagamente a un equivoco mancebo,
fue02-119|cuya túnica recogida hasta las caderas en un salto de bocacalle dejó ver sus piernas glabras,|cuya tunica recogida hasta las caderas en un salto de bocacalle dejo ver sus piernas glabras,
fue02-120|jaqueladas de cintas.|jaqueladas de cintas.
fue02-121|Las cortesanas, con el seno desnudo según la nueva moda, y apuntalado en deslumbrante coselete,|Las cortesanas, con el seno desnudo segun la nueva moda, y apuntalado en deslumbrante coselete,
fue02-122|paseaban su indolencia sudando perfumes.|paseaban su indolencia sudando perfumes.
fue02-123|Un viejo lenón, erguido en su carro, manejaba como si fuese una vela una hoja de estaño,|Un viejo lenon, erguido en su carro, manejaba como si fuese una vela una hoja de estano,
fue02-124|que con apropiadas pinturas anunciaba amores monstruosos de fieras:|que con apropiadas pinturas anunciaba amores monstruosos de fieras:
fue02-125|ayuntamientos de lagartos con cisnes;|ayuntamientos de lagartos con cisnes;
fue02-126|un mono y una foca;|un mono y una foca;
fue02-127|una doncella cubierta por la delirante pedrería de un pavo real.|una doncella cubierta por la delirante pedreria de un pavo real.
fue02-128|Bello cartel, a fe mía;|Bello cartel, a fe mia;
fue02-129|y garantida la autenticidad de las piezas.|y garantida la autenticidad de las piezas.
fue02-130|Animales amaestrados por no sé qué hechicería bárbara, y desequilibrados con opio y con asafétida.|Animales amaestrados por no se que hechiceria barbara, y desequilibrados con opio y con asafetida.
fue02-131|Seguido por tres jóvenes enmascarados pasó un negro amabilísimo,|Seguido por tres jovenes enmascarados paso un negro amabilisimo,
fue02-132|que dibujaba en los patios con polvos de colores derramados al ritmo de una danza, escenas secretas.|que dibujaba en los patios con polvos de colores derramados al ritmo de una danza, escenas secretas.
fue02-133|También depilaba al oropimente y sabía dorar las uñas.|Tambien depilaba al oropimente y sabia dorar las unas.
fue02-134|Un personaje fofo, cuya condición de eunuco se adivinaba en su morbidez,|Un personaje fofo, cuya condicion de eunuco se adivinaba en su morbidez,
fue02-135|pregonaba al son de crótalos de bronce, cobertores de un tejido singular que producía el insomnio y el deseo.|pregonaba al son de crotalos de bronce, cobertores de un tejido singular que producia el insomnio y el deseo.
fue02-136|Cobertores cuya abolición habían pedido los ciudadanos honrados.|Cobertores cuya abolicion habian pedido los ciudadanos honrados.
fue02-137|Pues mi ciudad sabía gozar, sabía vivir.|Pues mi ciudad sabia gozar, sabia vivir.
fue02-138|Al anochecer recibí dos visitas que cenaron conmigo.|Al anochecer recibi dos visitas que cenaron conmigo.
fue02-139|Un condiscípulo jovial, matemático cuya vida desarreglada era el escándalo de la ciencia,|Un condiscipulo jovial, matematico cuya vida desarreglada era el escandalo de la ciencia,
fue02-140|y un agricultor enriquecido.|y un agricultor enriquecido.
fue02-141|La gente sentía necesidad de visitarse después de aquellas chispas de cobre.|La gente sentia necesidad de visitarse despues de aquellas chispas de cobre.
fue02-142|De visitarse y de beber, pues ambos se retiraron completamente borrachos.|De visitarse y de beber, pues ambos se retiraron completamente borrachos.
fue02-143|Yo hice una rápida salida.|Yo hice una rapida salida.
fue02-144|La ciudad, caprichosamente iluminada, había aprovechado la coyuntura para decretarse una noche de fiesta.|La ciudad, caprichosamente iluminada, habia aprovechado la coyuntura para decretarse una noche de fiesta.
fue02-145|En algunas cornisas alumbraban perfumando lámparas de incienso.|En algunas cornisas alumbraban perfumando lamparas de incienso.
fue02-146|Desde sus balcones, las jóvenes burguesas, excesivamente ataviadas,|Desde sus balcones, las jovenes burguesas, excesivamente ataviadas,
fue02-147|se divertían en proyectar de un soplo a las narices de los transeúntes distraídos|se divertian en proyectar de un soplo a las narices de los transeuntes distraidos
fue02-148|tripas pintarrajeadas y crepitantes de cascabeles.|tripas pintarrajeadas y crepitantes de cascabeles.
fue02-149|En cada esquina se bailaba.|En cada esquina se bailaba.
fue02-150|De balcón a balcón cambiábanse flores y gatitos de dulce.|De balcon a balcon cambiabanse flores y gatitos de dulce.
fue02-151|El césped de los parques palpitaba de parejas…|El cesped de los parques palpitaba de parejas...
fue02-152|Regresé temprano y rendido.|Regrese temprano y rendido.
fue02-153|Nunca me acogí al lecho con más grata pesadez de sueño.|Nunca me acogi al lecho con mas grata pesadez de sueno.
fue02-154|Desperté bañado en sudor, los ojos turbios, la garganta reseca.|Desperte banado en sudor, los ojos turbios, la garganta reseca.
fue02-155|Había afuera un rumor de lluvia.|Habia afuera un rumor de lluvia.
fue02-156|Buscando algo, me apoyé en la pared, y por mi cuerpo corrió como un latigazo el escalofrío del miedo.|Buscando algo, me apoye en la pared, y por mi cuerpo corrio como un latigazo el escalofrio del miedo.
fue02-157|La pared estaba caliente y conmovida por una sorda vibración.|La pared estaba caliente y conmovida por una sorda vibracion.
fue02-158|Casi no necesité abrir la ventana para darme cuenta de lo que ocurría.La lluvia de cobre había vuelto, pero esta vez nutrida y compacta.|Casi no necesite abrir la ventana para darme cuenta de lo que ocurria.La lluvia de cobre habia vuelto, pero esta vez nutrida y compacta.
fue02-159|Un caliginoso vaho sofocaba la ciudad;|Un caliginoso vaho sofocaba la ciudad;
fue02-160|un olor entre fosfatado y urinoso apestaba el aire.|un olor entre fosfatado y urinoso apestaba el aire.
fue02-161|Por fortuna, mi casa estaba rodeada de galerías y aquella lluvia no alcanzaba las puertas.|Por fortuna, mi casa estaba rodeada de galerias y aquella lluvia no alcanzaba las puertas.
fue02-162|Abrí la que daba al jardín.|Abri la que daba al jardin.
fue02-163|Los árboles estaban negros, ya sin follaje;|Los arboles estaban negros, ya sin follaje;
fue02-164|el piso, cubierto de hojas carbonizadas.|el piso, cubierto de hojas carbonizadas.
fue02-165|El aire, rayado de vírgulas de fuego, era de una paralización mortal;|El aire, rayado de virgulas de fuego, era de una paralizacion mortal;
fue02-166|y por entre aquéllas se divisaba el firmamento, siempre impasible, siempre celeste.|y por entre aquellas se divisaba el firmamento, siempre impasible, siempre celeste.
fue02-167|llamé en vano.|llame en vano.
fue02-168|Penetré hasta los aposentos famularios.|Penetre hasta los aposentos famularios.
fue02-169|La servidumbre se había ido.|La servidumbre se habia ido.
fue02-170|Envueltas las piernas en un cobertor de biso,|Envueltas las piernas en un cobertor de biso,
fue02-171|acorazándome espaldas y cabeza con una bañera de metal que me aplastaba horriblemente,|acorazandome espaldas y cabeza con una banera de metal que me aplastaba horriblemente,
fue02-172|pude llegar hasta las caballerizas.|pude llegar hasta las caballerizas.
fue02-173|Los caballos habían desaparecido también.|Los caballos habian desaparecido tambien.
fue02-174|Y con una tranquilidad que hacía honor a mis nervios, me di cuenta de que estaba perdido.|Y con una tranquilidad que hacia honor a mis nervios, me di cuenta de que estaba perdido.
fue02-175|Afortunadamente, el comedor se encontraba lleno de provisiones;|Afortunadamente, el comedor se encontraba lleno de provisiones;
fue02-176|su sótano, atestado de vinos.|su sotano, atestado de vinos.
fue02-177|Bajé a él. Conservaba todavía su frescura;|Baje a el. Conservaba todavia su frescura;
fue02-178|hasta su fondo no llegaba la vibración de la pesada lluvia, el eco de su grave crepitación.|hasta su fondo no llegaba la vibracion de la pesada lluvia, el eco de su grave crepitacion.
fue02-179|Bebí una botella, y luego extraje de la alacena secreta el pomo de vino envenenado.|Bebi una botella, y luego extraje de la alacena secreta el pomo de vino envenenado.
fue02-180|Todos los que teníamos bodega poseíamos uno, aunque no lo usáramos ni tuviéramos convidados cargosos.|Todos los que teniamos bodega poseiamos uno, aunque no lo usaramos ni tuvieramos convidados cargosos.
fue02-181|Era un licor claro e insípido, de efectos instantáneos.|Era un licor claro e insipido, de efectos instantaneos.
fue02-182|Reanimado por el vino, examiné mi situación.|Reanimado por el vino, examine mi situacion.
fue02-183|Era asaz sencilla.|Era asaz sencilla.
fue02-184|No pudiendo huir, la muerte me esperaba;|No pudiendo huir, la muerte me esperaba;
fue02-185|pero con el veneno aquel, la muerte me pertenecía.|pero con el veneno aquel, la muerte me pertenecia.
fue02-186|Y decidí ver eso todo lo posible, pues era, a no dudarlo, un espectáculo singular.|Y decidi ver eso todo lo posible, pues era, a no dudarlo, un espectaculo singular.
fue02-187|¡Una lluvia de cobre incandescente! ¡La ciudad en llamas! Valía la pena.|!Una lluvia de cobre incandescente! !La ciudad en llamas! Valia la pena.
fue02-188|Subí a la terraza, pero no pude pasar de la puerta que daba acceso a ella.|Subi a la terraza, pero no pude pasar de la puerta que daba acceso a ella.
fue02-189|Veía desde allá lo bastante, sin embargo.|Veia desde alla lo bastante, sin embargo.
fue02-190|Veía y escuchaba.|Veia y escuchaba.
fue02-191|La soledad era absoluta.|La soledad era absoluta.
fue02-192|La crepitación no se interrumpía sino por uno que otro ululato de perro, o explosión anormal.|La crepitacion no se interrumpia sino por uno que otro ululato de perro, o explosion anormal.
fue02-193|El ambiente estaba rojo;|El ambiente estaba rojo;
fue02-194|y a su través, troncos, chimeneas, casas, blanqueaban con una lividez tristísima.|y a su traves, troncos, chimeneas, casas, blanqueaban con una lividez tristisima.
fue02-195|Los pocos árboles que conservaban follaje retorcíanse, negros, de un negro de estaño.|Los pocos arboles que conservaban follaje retorcianse, negros, de un negro de estano.
fue02-196|La luz había decrecido un poco, no obstante la persistencia de la limpidez celeste.|La luz habia decrecido un poco, no obstante la persistencia de la limpidez celeste.
fue02-197|El horizonte estaba, esto sí, mucho más cerca, y como ahogado en ceniza.|El horizonte estaba, esto si, mucho mas cerca, y como ahogado en ceniza.
fue02-198|Sobre el lago flotaba un denso vapor, que algo corregía la extraordinaria sequedad del aire.|Sobre el lago flotaba un denso vapor, que algo corregia la extraordinaria sequedad del aire.
fue02-199|Percibíase claramente la combustible lluvia,|Percibiase claramente la combustible lluvia,
fue02-200|en trazos de cobre que vibraban como el cordaje innumerable de un arpa,|en trazos de cobre que vibraban como el cordaje innumerable de un arpa,
fue02-201|y de cuando en cuando mezclábanse con ella ligeras flámulas:|y de cuando en cuando mezclabanse con ella ligeras flamulas:
fue02-202|Humaredas negras anunciaban incendios aquí y allá.|Humaredas negras anunciaban incendios aqui y alla.
fue02-203|Mis pájaros comenzaban a morir de sed y hube de bajar hasta el aljibe para llevarles agua.|Mis pajaros comenzaban a morir de sed y hube de bajar hasta el aljibe para llevarles agua.
fue02-204|El sótano comunicaba con aquel depósito, vasta cisterna que podía resistir mucho al fuego celeste;|El sotano comunicaba con aquel deposito, vasta cisterna que podia resistir mucho al fuego celeste;
fue02-205|mas por los conductos que del techo y de los patios desembocaban allá habíase deslizado algún cobre,|mas por los conductos que del techo y de los patios desembocaban alla habiase deslizado algun cobre,
fue02-206|y el agua tenía un gusto particular, entre natrón y orina, con tendencia a salarse.|y el agua tenia un gusto particular, entre natron y orina, con tendencia a salarse.
fue02-207|Bastóme levantar las trampillas de mosaico que cerraban aquellas vías,|Bastome levantar las trampillas de mosaico que cerraban aquellas vias,
fue02-208|para cortar a mi agua toda comunicación con el exterior.|para cortar a mi agua toda comunicacion con el exterior.
fue02-209|Esa tarde y toda la noche fue horrendo el espectáculo de la ciudad.|Esa tarde y toda la noche fue horrendo el espectaculo de la ciudad.
fue02-210|Quemada en sus domicilios, la gente huía despavorida, para arderse en las calles, en la campiña desolada;|Quemada en sus domicilios, la gente huia despavorida, para arderse en las calles, en la campina desolada;
fue02-211|y la población agonizó bárbaramente, con ayes y clamores de una amplitud,|y la poblacion agonizo barbaramente, con ayes y clamores de una amplitud,
fue02-212|de un horror, de una variedad estupendos.|de un horror, de una variedad estupendos.
fue02-213|Nada hay tan sublime como la voz humana.|Nada hay tan sublime como la voz humana.
fue02-214|El derrumbe de los edificios, la combustión de tantas mercancías y efectos diversos,|El derrumbe de los edificios, la combustion de tantas mercancias y efectos diversos,
fue02-215|y más que todo la quemazón de tantos cuerpos acabaron por agregar al cataclismo|y mas que todo la quemazon de tantos cuerpos acabaron por agregar al cataclismo
fue02-216|el tormento de su hedor infernal.|el tormento de su hedor infernal.
fue02-217|Al declinar el sol, el aire estaba casi negro de humo y polvaredas.|Al declinar el sol, el aire estaba casi negro de humo y polvaredas.
fue02-218|Las flámulas que danzaban por la mañana entre el cobre pluvial eran ahora llamaradas siniestras.|Las flamulas que danzaban por la manana entre el cobre pluvial eran ahora llamaradas siniestras.
fue02-219|Empezó a soplar un viento ardentísimo, denso, como alquitrán caliente.|Empezo a soplar un viento ardentisimo, denso, como alquitran caliente.
fue02-220|Parecía que se estuviese en un inmenso horno sombrío.|Parecia que se estuviese en un inmenso horno sombrio.
fue02-221|Cielo, tierra, aire:|Cielo, tierra, aire:
fue02-222|todo acababa:|todo acababa:
fue02-223|no había más que tinieblas y fuego.|no habia mas que tinieblas y fuego.
fue02-224|¡Ah, el horror de aquellas tinieblas que todo el fuego,|!Ah, el horror de aquellas tinieblas que todo el fuego,
fue02-225|el enorme fuego de la ciudad ardida no alcanzaba a dominar;|el enorme fuego de la ciudad ardida no alcanzaba a dominar;
fue02-226|y aquella fetidez de pingajos, de azufre, de grasa cadavérica en el aire seco que hacía escupir sangre;|y aquella fetidez de pingajos, de azufre, de grasa cadaverica en el aire seco que hacia escupir sangre;
