fue01-140|la proporción entre las ondulaciones de aquélla y su traslación quedaba rota con ventaja,|la proporcion entre las ondulaciones de aquella y su traslacion quedaba rota con ventaja,
fue01-141|y libertada por lo tanto la potencia mecánica del sonido.|y libertada por lo tanto la potencia mecanica del sonido.
fue01-142|Mi aparato va a demostrarles que todo esto se puede;|Mi aparato va a demostrarles que todo esto se puede;
fue01-143|pero aún no les he dicho lo que me proponía hacer.|pero aun no les he dicho lo que me proponia hacer.
fue01-144|Yo considero que el sonido es materia, desprendida en partículas infinitesimales del cuerpo sonoro,|Yo considero que el sonido es materia, desprendida en particulas infinitesimales del cuerpo sonoro,
fue01-145|y dinamizada en tal forma, que da la sensación de sonido, como las partículas odoríferas dan la sensación del olor.|y dinamizada en tal forma, que da la sensacion de sonido, como las particulas odoriferas dan la sensacion del olor.
fue01-146|Esa materia se desprende en la forma ondulatoria comprobada por la ciencia y que yo me proponía modificar,|Esa materia se desprende en la forma ondulatoria comprobada por la ciencia y que yo me proponia modificar,
fue01-147|engendrando la onda aérea conocida por nosotros;|engendrando la onda aerea conocida por nosotros;
fue01-148|del propio modo que la ondulación de una anguila bajo el agua es repetida por ésta en su superficie.|del propio modo que la ondulacion de una anguila bajo el agua es repetida por esta en su superficie.
fue01-149|Cuando la doble onda choca con un cuerpo, la parte aérea se refleja contra su superficie;|Cuando la doble onda choca con un cuerpo, la parte aerea se refleja contra su superficie;
fue01-150|la aérea penetra, produciendo la vibración del cuerpo y sin ninguna otra consecuencia,|la aerea penetra, produciendo la vibracion del cuerpo y sin ninguna otra consecuencia,
fue01-151|pues el éter del cuerpo supuesto se dinamiza armónicamente con el de la onda, difundido en él;|pues el eter del cuerpo supuesto se dinamiza armonicamente con el de la onda, difundido en el;
fue01-152|y ésta es la explicación, que se da por primera vez, de las vibraciones al unísono.|y esta es la explicacion, que se da por primera vez, de las vibraciones al unisono.
fue01-153|Una vez rota la relación entre las ondulaciones y su propagación,|Una vez rota la relacion entre las ondulaciones y su propagacion,
fue01-154|el éter sonoro no se difunde en la masa del cuerpo, sino que la perfora, ya completamente, ya hasta cierta profundidad.|el eter sonoro no se difunde en la masa del cuerpo, sino que la perfora, ya completamente, ya hasta cierta profundidad.
fue01-155|Y aquí viene la explicación misma de los fenómenos que produzco.|Y aqui viene la explicacion misma de los fenomenos que produzco.
fue01-156|Todo cuerpo tiene un centro formado por la gravitación de moléculas que constituye su cohesión,|Todo cuerpo tiene un centro formado por la gravitacion de moleculas que constituye su cohesion,
fue01-157|y que representa el peso total de dichas moléculas.|y que representa el peso total de dichas moleculas.
fue01-158|No necesito advertir que ese centro puede encontrarse en cualquier punto del cuerpo.|No necesito advertir que ese centro puede encontrarse en cualquier punto del cuerpo.
fue01-159|Las moléculas representan aquí lo que las masas planetarias en el espacio.|Las moleculas representan aqui lo que las masas planetarias en el espacio.
fue01-160|Claro es que el más mínimo desplazamiento del centro en cuestión ocasionará instantáneamente la desintegración del cuerpo;|Claro es que el mas minimo desplazamiento del centro en cuestion ocasionara instantaneamente la desintegracion del cuerpo;
fue01-161|pero no es menos cierto que para efectuarlo, venciendo la cohesión molecular,|pero no es menos cierto que para efectuarlo, venciendo la cohesion molecular,
fue01-162|se necesitaría una fuerza enorme, algo de que la mecánica actual no tiene idea, y que yo he descubierto, sin embargo.|se necesitaria una fuerza enorme, algo de que la mecanica actual no tiene idea, y que yo he descubierto, sin embargo.
fue01-163|Tyndall ha dicho en un ejemplo gráfico que la fuerza del puñado de nieve contenido en la mano de un niño|Tyndall ha dicho en un ejemplo grafico que la fuerza del punado de nieve contenido en la mano de un nino
fue01-164|bastaría para hacer volar en pedazos una montaña.|bastaria para hacer volar en pedazos una montana.
fue01-165|Calculen ustedes lo que se necesitará para vencer esa fuerza.|Calculen ustedes lo que se necesitara para vencer esa fuerza.
fue01-166|Y yo desintegro bloques de granito de un metro cúbico…|Y yo desintegro bloques de granito de un metro cubico...
fue01-167|Decía aquello sencillamente, como la cosa más natural, sin ocuparse de nuestra aquiescencia.|Decia aquello sencillamente, como la cosa mas natural, sin ocuparse de nuestra aquiescencia.
fue01-168|Nosotros, aunque vagamente, íbamonos turbando con la inminencia de una gran revelación;|Nosotros, aunque vagamente, ibamonos turbando con la inminencia de una gran revelacion;
fue01-169|pero acostumbrados al tono autoritario de nuestro amigo, nada replicábamos.|pero acostumbrados al tono autoritario de nuestro amigo, nada replicabamos.
fue01-170|Nuestros ojos, eso sí, buscaban al descuido por el taller los misteriosos aparatos.|Nuestros ojos, eso si, buscaban al descuido por el taller los misteriosos aparatos.
fue01-171|A no ser un volante de eje solidísimo, nada había que no nos fuese familiar.|A no ser un volante de eje solidisimo, nada habia que no nos fuese familiar.
fue01-172|—Llegamos —prosiguió el descubridor— al final de la exposición.|--Llegamos --prosiguio el descubridor-- al final de la exposicion.
fue01-173|Había dicho que necesitaba ondas sonoras susceptibles de ser lanzadas en progresión proporcional,|Habia dicho que necesitaba ondas sonoras susceptibles de ser lanzadas en progresion proporcional,
fue01-174|y a vuelta de muchos tanteos, que no es menester describirlos, di con ellas.|y a vuelta de muchos tanteos, que no es menester describirlos, di con ellas.
fue01-175|Eran el do, fa, sol, do, que según la tradición antigua constituían la lira de Orfeo|Eran el do, fa, sol, do, que segun la tradicion antigua constituian la lira de Orfeo
fue01-176|y que contienen los intervalos más importantes de la declamación, es decir, el secreto musical de la voz humana.|y que contienen los intervalos mas importantes de la declamacion, es decir, el secreto musical de la voz humana.
fue01-177|La relación de estas ondas es matemáticamente 1, 4/3, 3/2, 2;|La relacion de estas ondas es matematicamente uno, cuatro/tres, tres/dos, dos;
fue01-178|y arrancadas de la naturaleza, sin un agregado o deformación que las altere, son también una fuerza original.|y arrancadas de la naturaleza, sin un agregado o deformacion que las altere, son tambien una fuerza original.
fue01-179|Ya ven ustedes que la lógica de los hechos iba paralela con la de la teoría.|Ya ven ustedes que la logica de los hechos iba paralela con la de la teoria.
fue01-180|Procedí entonces a construir mi aparato;|Procedi entonces a construir mi aparato;
fue01-181|mas, para llegar al que ustedes ven aquí —dijo sacando de su bolsillo un disco harto semejante a un reloj de níquel—,|mas, para llegar al que ustedes ven aqui --dijo sacando de su bolsillo un disco harto semejante a un reloj de niquel--,
fue01-182|ensayé diversas máquinas.|ensaye diversas maquinas.
fue01-183|Confieso que el aparato nos defraudó.|Confieso que el aparato nos defraudo.
fue01-184|La relación de magnitudes forma de tal modo la esencia del criterio humano,|La relacion de magnitudes forma de tal modo la esencia del criterio humano,
fue01-185|que al oír hablar de fuerzas enormes habíamos presentido máquinas grandiosas.|que al oir hablar de fuerzas enormes habiamos presentido maquinas grandiosas.
fue01-186|Aquella cajita redonda, con un botón saliente en su borde, parecía cualquier cosa menos un generador de éter vibratorio.|Aquella cajita redonda, con un boton saliente en su borde, parecia cualquier cosa menos un generador de eter vibratorio.
fue01-187|—Primero —continuó el otro, sonriendo ante nuestra perplejidad— pensé en cosas complicadas, análogas a las sirenas de Koenig.|--Primero --continuo el otro, sonriendo ante nuestra perplejidad-- pense en cosas complicadas, analogas a las sirenas de Koenig.
fue01-188|Luego fui simplificando de acuerdo con mis ideas sobre la deficiencia de las máquinas,|Luego fui simplificando de acuerdo con mis ideas sobre la deficiencia de las maquinas,
fue01-189|hasta llegar a esto, que no es sino una solución transitoria.|hasta llegar a esto, que no es sino una solucion transitoria.
fue01-190|La delicadeza del aparato no permite abrirlo a cada momento;|La delicadeza del aparato no permite abrirlo a cada momento;
fue01-191|pero ustedes deben conocerlo —añadió, destornillando su tapa.|pero ustedes deben conocerlo --anadio, destornillando su tapa.
fue01-192|Contenía cuatro diapasoncillos, poco menos finos que cerdas,|Contenia cuatro diapasoncillos, poco menos finos que cerdas,
fue01-193|implantados a intervalos desiguales sobre un diafragma de madera que constituía el fondo de la caja.|implantados a intervalos desiguales sobre un diafragma de madera que constituia el fondo de la caja.
fue01-194|Un sutilísimo alambre se tendía y distendía rozándolos, bajo la acción del botón que sobresalía;|Un sutilisimo alambre se tendia y distendia rozandolos, bajo la accion del boton que sobresalia;
fue01-195|y la boquilla de que antes hablé era una bocina microfónica.|y la boquilla de que antes hable era una bocina microfonica.
fue01-196|—Los intervalos entre diapasón y diapasón, tanto como el espacio necesario para el juego de la cuerda que los roza,|--Los intervalos entre diapason y diapason, tanto como el espacio necesario para el juego de la cuerda que los roza,
fue01-197|imponían al aparato este tamaño mínimo.|imponian al aparato este tamano minimo.
fue01-198|Cuando ellos suenan, la cuádruple onda transformada en una sale por la bocina microfónica como un verdadero proyectil etéreo.|Cuando ellos suenan, la cuadruple onda transformada en una sale por la bocina microfonica como un verdadero proyectil etereo.
fue01-199|La descarga se repite cuantas veces aprieto el botón,|La descarga se repite cuantas veces aprieto el boton,
fue01-200|pudiendo salir las ondas sin solución de continuidad apreciable, es decir, mucho más próximas que las balas de una ametralladora,|pudiendo salir las ondas sin solucion de continuidad apreciable, es decir, mucho mas proximas que las balas de una ametralladora,
fue01-201|y formar un verdadero chorro de éter dinámico cuya potencia es incalculable.|y formar un verdadero chorro de eter dinamico cuya potencia es incalculable.
fue01-202|Si la onda va al centro molecular del cuerpo, éste se desintegra en partículas impalpables.|Si la onda va al centro molecular del cuerpo, este se desintegra en particulas impalpables.
fue01-203|Si no, lo perfora con un agujerillo enteramente imperceptible.|Si no, lo perfora con un agujerillo enteramente imperceptible.
fue01-204|En cuanto al roce tangencial, van a ver ustedes sus efectos sobre aquel volante…|En cuanto al roce tangencial, van a ver ustedes sus efectos sobre aquel volante...
fue01-205|—… ¿Qué pesa…? —interrumpí.|--... ?Que pesa...? --interrumpi.
fue01-206|—Trescientos kilogramos.|--Trescientos kilogramos.
fue01-207|El botón comenzó a actuar con ruidecito intermitente y seco, ante nuestra curiosidad todavía incrédula;|El boton comenzo a actuar con ruidecito intermitente y seco, ante nuestra curiosidad todavia incredula;
fue01-208|y como el silencio era grande, percibimos apenas una aguda estridencia, análoga al zumbido de un insecto.|y como el silencio era grande, percibimos apenas una aguda estridencia, analoga al zumbido de un insecto.
fue01-209|No tardó mucho en ponerse en movimiento la mole, y aquél fue acelerándose de tal modo,|No tardo mucho en ponerse en movimiento la mole, y aquel fue acelerandose de tal modo,
fue01-210|que pronto vibró la casa entera como al empuje de un huracán.|que pronto vibro la casa entera como al empuje de un huracan.
fue01-211|La maciza rueda no era más que una sombra vaga, semejante al ala de un colibrí en suspensión,|La maciza rueda no era mas que una sombra vaga, semejante al ala de un colibri en suspension,
fue01-212|y el aire desplazado por ella provocaba un torbellino dentro del cuarto.|y el aire desplazado por ella provocaba un torbellino dentro del cuarto.
fue01-213|El descubridor suspendió muy luego los efectos de su aparato,|El descubridor suspendio muy luego los efectos de su aparato,
fue01-214|pues ningún eje habría aguantado mucho tiempo semejante trabajo.|pues ningun eje habria aguantado mucho tiempo semejante trabajo.
fue01-215|Mirábamos suspensos, con una mezcla de admiración y pavor, trocada muy luego en desmedida curiosidad.|Mirabamos suspensos, con una mezcla de admiracion y pavor, trocada muy luego en desmedida curiosidad.
fue01-216|El médico quiso repetir el experimento;|El medico quiso repetir el experimento;
fue01-217|pero por más que abocó la cajita hacia el volante, nada consiguió.|pero por mas que aboco la cajita hacia el volante, nada consiguio.
fue01-218|Yo intenté lo propio con igual desventura.|Yo intente lo propio con igual desventura.
fue01-219|Creíamos ya en una broma de nuestro amigo, cuando éste dijo, poniéndose tan grave que casi daba en taciturno:|Creiamos ya en una broma de nuestro amigo, cuando este dijo, poniendose tan grave que casi daba en taciturno:
fue01-220|—Es que aquí está el misterio de mi fuerza.|--Es que aqui esta el misterio de mi fuerza.
fue01-221|Nadie, sino yo, puede usarla.|Nadie, sino yo, puede usarla.
fue01-222|Y yo mismo no sé cómo sucede.|Y yo mismo no se como sucede.
fue01-223|Defino, sí, lo que pasa por mí como una facultad análoga a la puntería.|Defino, si, lo que pasa por mi como una facultad analoga a la punteria.
fue01-224|Sin verlo, sin percibirlo en ninguna forma material yo sé|Sin verlo, sin percibirlo en ninguna forma material yo se
fue01-225|dónde está el centro del cuerpo que deseo desintegrar y en la misma forma proyecto mi éter contra el volante ante.|donde esta el centro del cuerpo que deseo desintegrar y en la misma forma proyecto mi eter contra el volante ante.
fue01-226|Prueben ustedes cuanto quieran.|Prueben ustedes cuanto quieran.
fue01-227|Quizá al fin…|Quiza al fin...
fue01-228|Todo fue en vano.|Todo fue en vano.
fue01-229|La onda etérea se dispersaba inútil.|La onda eterea se dispersaba inutil.
fue01-230|En cambio, bajo la dirección de su amo, llamémosle así, ejecutó prodigios.|En cambio, bajo la direccion de su amo, llamemosle asi, ejecuto prodigios.
fue01-231|Un adoquín que calzaba la puerta rebelde se desintegró a nuestra vista,|Un adoquin que calzaba la puerta rebelde se desintegro a nuestra vista,
fue01-232|convirtiéndose con leve sacudida en un montón de polvo impalpable.|convirtiendose con leve sacudida en un monton de polvo impalpable.
fue01-233|Varios trozos de hierro sufrieron la misma suerte.|Varios trozos de hierro sufrieron la misma suerte.
fue01-234|Y resultaba en verdad de un efecto mágico aquella transformación de la materia,|Y resultaba en verdad de un efecto magico aquella transformacion de la materia,
fue01-235|sin un esfuerzo perceptible, sin un ruido, como no fuera la leve estridencia que cualquier rumor ahogaba.|sin un esfuerzo perceptible, sin un ruido, como no fuera la leve estridencia que cualquier rumor ahogaba.
fue01-236|El médico, entusiasmado, quería escribir un artículo.|El medico, entusiasmado, queria escribir un articulo.
fue01-237|—No —dijo nuestro amigo—;|--No --dijo nuestro amigo--;
fue01-238|detesto la notoriedad, aunque no he podido evitarla del todo, pues los vecinos comienzan a enterarse.|detesto la notoriedad, aunque no he podido evitarla del todo, pues los vecinos comienzan a enterarse.
fue01-239|Además, temo los daños que puede causar esto…|Ademas, temo los danos que puede causar esto...
fue01-240|—En efecto —dije—;|--En efecto --dije--;
fue01-241|como arma sería espantoso.|como arma seria espantoso.
fue01-242|—¿No lo has ensayado sobre algún animal? —preguntó el médico.|--?No lo has ensayado sobre algun animal? --pregunto el medico.
fue01-243|—Ya sabes —respondió nuestro amigo con grave mansedumbre— que jamás causo dolor a ningún ser viviente.|--Ya sabes --respondio nuestro amigo con grave mansedumbre-- que jamas causo dolor a ningun ser viviente.
fue01-244|Y con esto terminó la sesión.|Y con esto termino la sesion.
fue01-245|Los días siguientes trascurrieron entre maravillas;|Los dias siguientes trascurrieron entre maravillas;
fue01-246|y recuerdo como particularmente notable la desintegración de un vaso de agua,|y recuerdo como particularmente notable la desintegracion de un vaso de agua,
fue01-247|que desapareció de súbito cubriendo de rocío toda la habitación.|que desaparecio de subito cubriendo de rocio toda la habitacion.
fue01-248|—El vaso permanece —explicaba el sabio— porque no forma un bloque con el agua,|--El vaso permanece --explicaba el sabio-- porque no forma un bloque con el agua,
fue01-249|a causa de que no hay entre ésta y el cristal adherencia perfecta.|a causa de que no hay entre esta y el cristal adherencia perfecta.
fue01-250|Lo mismo sucedería si estuviera herméticamente cerrado.|Lo mismo sucederia si estuviera hermeticamente cerrado.
fue01-251|El líquido, convertido en partículas etéreas, sería proyectado a través de los poros del metal|El liquido, convertido en particulas etereas, seria proyectado a traves de los poros del metal
fue01-252|Así marchamos de asombro en asombro;|Asi marchamos de asombro en asombro;
fue01-253|mas el secreto no podía prolongarse, y es imposible valorar lo que se perdió|mas el secreto no podia prolongarse, y es imposible valorar lo que se perdio
fue01-254|en el triste suceso cuyo relato finalizará esta historia.|en el triste suceso cuyo relato finalizara esta historia.
fue01-255|Lo cierto es —para qué entretenerse en cosas tristes— que una de esas mañanas encontramos a nuestro amigo, muerto,|Lo cierto es --para que entretenerse en cosas tristes-- que una de esas mananas encontramos a nuestro amigo, muerto,
fue01-256|con la cabeza recostada en el respaldo de su silla.|con la cabeza recostada en el respaldo de su silla.
fue01-257|Fácil es imaginar nuestra consternación.|Facil es imaginar nuestra consternacion.
fue01-258|El aparato maravilloso estaba ante él y nada anormal se notaba en el laboratorio.|El aparato maravilloso estaba ante el y nada anormal se notaba en el laboratorio.
fue01-259|Mirábamos sorprendidos, sin conjeturar ni lejanamente la causa de aquel desastre,|Mirabamos sorprendidos, sin conjeturar ni lejanamente la causa de aquel desastre,
fue01-260|cuando noté de pronto que la pared a la cual casi tocaba la cabeza del muerto|cuando note de pronto que la pared a la cual casi tocaba la cabeza del muerto
fue01-261|se hallaba cubierta de una capa grasosa,una especie de manteca.|se hallaba cubierta de una capa grasosa,una especie de manteca.
fue01-262|Casi al mismo tiempo mi compañero lo advirtió también, y raspando con su dedo sobre aquella mixtura, exclamó sorprendido:|Casi al mismo tiempo mi companero lo advirtio tambien, y raspando con su dedo sobre aquella mixtura, exclamo sorprendido:
fue01-263|—¡Esto es sustancia cerebral!|--!Esto es sustancia cerebral!
fue01-264|La autopsia confirmó su dicho, certificando una nueva maravilla del portentoso aparato.|La autopsia confirmo su dicho, certificando una nueva maravilla del portentoso aparato.
fue01-265|Efectivamente, la cabeza de nuestro pobre amigo estaba vacía, sin un átomo de sesos.|Efectivamente, la cabeza de nuestro pobre amigo estaba vacia, sin un atomo de sesos.
fue01-266|El proyectil etéreo, quién sabe por qué rareza de dirección o por qué descuido,|El proyectil etereo, quien sabe por que rareza de direccion o por que descuido,
fue01-267|habíale desintegrado el cerebro, proyectándolo en explosión atómica a través de los poros de su cráneo.|habiale desintegrado el cerebro, proyectandolo en explosion atomica a traves de los poros de su craneo.
fue01-268|Ni un rastro exterior denunciaba la catástrofe, y aquel fenómeno, con todo su horror,|Ni un rastro exterior denunciaba la catastrofe, y aquel fenomeno, con todo su horror,
fue01-269|era, a fe mía, el más estupendo de cuantos habíamos presenciado.|era, a fe mia, el mas estupendo de cuantos habiamos presenciado.
fue01-270|Sobre mi mesa de trabajo, aquí mismo, en tanto que finalizo esta historia,|Sobre mi mesa de trabajo, aqui mismo, en tanto que finalizo esta historia,
fue01-271|el aparato en cuestión brilla, diríase siniestramente, al alcance de mi mano.|el aparato en cuestion brilla, diriase siniestramente, al alcance de mi mano.
fue01-272|Funciona perfectamente;|Funciona perfectamente;
fue01-273|pero el éter formidable, la sustancia prodigiosa y homicida de la cual tengo,|pero el eter formidable, la sustancia prodigiosa y homicida de la cual tengo,
fue01-274|¡ay!, tan desgraciada prueba, se pierde sin rumbo en el espacio, a pesar de todas mis vanas tentativas.|!ay!, tan desgraciada prueba, se pierde sin rumbo en el espacio, a pesar de todas mis vanas tentativas.
fue01-275|En el instituto Lutz y Schultz han ensayado también sin éxito.|En el instituto Lutz y Schultz han ensayado tambien sin exito.
fue02-01|LA LLUVIA DE FUEGO|LA LLUVIA DE FUEGO
fue02-02|Recuerdo que era un día de sol hermoso, lleno del hormigueo popular en las calles atronadas de vehículos.|Recuerdo que era un dia de sol hermoso, lleno del hormigueo popular en las calles atronadas de vehiculos.
fue02-03|Un día asaz cálido y de tersura perfecta.|Un dia asaz calido y de tersura perfecta.
fue02-04|Desde mi terraza dominaba una vasta confusión de techos, vergeles salteados,|Desde mi terraza dominaba una vasta confusion de techos, vergeles salteados,
fue02-05|un trozo de bahía punzado de mástiles, la recta gris de una avenida…|un trozo de bahia punzado de mastiles, la recta gris de una avenida...
fue02-06|A eso de las once cayeron las primeras chispas.|A eso de las once cayeron las primeras chispas.
fue02-07|Una aquí, otra allá —partículas de cobre semejantes a las morcellas de un pabilo;|Una aqui, otra alla --particulas de cobre semejantes a las morcellas de un pabilo;
fue02-08|partículas de cobre incandescente que daban en el suelo con un ruidecito de arena.|particulas de cobre incandescente que daban en el suelo con un ruidecito de arena.
fue02-09|El cielo seguía de igual limpidez;|El cielo seguia de igual limpidez;
fue02-10|el rumor urbano no decrecía.|el rumor urbano no decrecia.
fue02-11|Únicamente los pájaros de mi pajarera cesaron de cantar.|Unicamente los pajaros de mi pajarera cesaron de cantar.
fue02-12|Casualmente lo había advertido, mirando hacia el horizonte en un momento de abstracción.|Casualmente lo habia advertido, mirando hacia el horizonte en un momento de abstraccion.
fue02-13|Primero creí en una ilusión óptica formada por mi miopía.|Primero crei en una ilusion optica formada por mi miopia.
fue02-14|Tuve que esperar largo rato para ver caer otra chispa, pues la luz solar anegábalas bastante;|Tuve que esperar largo rato para ver caer otra chispa, pues la luz solar anegabalas bastante;
fue02-15|pero el cobre ardía de tal modo, que se destacaban lo mismo.|pero el cobre ardia de tal modo, que se destacaban lo mismo.
fue02-16|Una rapidísima vírgula de fuego, y el golpecito en la tierra.|Una rapidisima virgula de fuego, y el golpecito en la tierra.
fue02-17|Así, a largos intervalos.|Asi, a largos intervalos.
fue02-18|Debo confesar que al comprobarlo experimenté un vago terror.|Debo confesar que al comprobarlo experimente un vago terror.
fue02-19|Exploré el cielo en una ansiosa ojeada.|Explore el cielo en una ansiosa ojeada.
fue02-20|Persistía la limpidez.|Persistia la limpidez.
fue02-21|¿De dónde venía aquel extraño granizo? ¿Aquel cobre? ¿Era cobre…?|?De donde venia aquel extrano granizo? ?Aquel cobre? ?Era cobre...?
fue02-22|Acababa de caer una chispa en mi terraza, a pocos pasos.|Acababa de caer una chispa en mi terraza, a pocos pasos.
fue02-23|Extendí la mano;|Extendi la mano;
fue02-24|era, a no caber duda, un gránulo de cobre que tardó mucho en enfriarse.|era, a no caber duda, un granulo de cobre que tardo mucho en enfriarse.
fue02-25|Por fortuna la brisa se levantaba, inclinando aquella lluvia singular hacia el lado opuesto de mi terraza.|Por fortuna la brisa se levantaba, inclinando aquella lluvia singular hacia el lado opuesto de mi terraza.
fue02-26|Las chispas eran harto ralas, además.|Las chispas eran harto ralas, ademas.
fue02-27|Podía creerse por momentos que aquello había ya cesado.|Podia creerse por momentos que aquello habia ya cesado.
fue02-28|No cesaba.|No cesaba.
fue02-29|Uno que otro, eso sí, pero caían siempre los temibles gránulos.|Uno que otro, eso si, pero caian siempre los temibles granulos.
fue02-30|En fin, aquello no había de impedirme almorzar, pues era el mediodía.|En fin, aquello no habia de impedirme almorzar, pues era el mediodia.
fue02-31|Bajé al comedor atravesando el jardín, no sin cierto miedo de las chispas.|Baje al comedor atravesando el jardin, no sin cierto miedo de las chispas.
fue02-32|Verdad es que el toldo, corrido para evitar el sol, me resguardaba…|Verdad es que el toldo, corrido para evitar el sol, me resguardaba...
fue02-33|¿Me resguardaba? Alcé los ojos;|?Me resguardaba? Alce los ojos;
