fue02-227|y aquellos clamores que no sé cómo no acababan nunca, aquellos clamores que cubrían el rumor del incendio,|y aquellos clamores que no se como no acababan nunca, aquellos clamores que cubrian el rumor del incendio,
fue02-228|más vasto que un huracán, aquellos clamores en que aullaban, gemían, bramaban|mas vasto que un huracan, aquellos clamores en que aullaban, gemian, bramaban
fue02-229|todas las bestias con un inefable pavor de eternidad…!|todas las bestias con un inefable pavor de eternidad...!
fue02-230|Mi casa empezaba a arder.|Mi casa empezaba a arder.
fue02-231|Bajé a la cisterna, sin haber perdido hasta entonces mi presencia de ánimo,|Baje a la cisterna, sin haber perdido hasta entonces mi presencia de animo,
fue02-232|pero enteramente erizado con todo aquel horror;|pero enteramente erizado con todo aquel horror;
fue02-233|y al verme de pronto en esa oscuridad amiga, al amparo de la frescura, ante el silencio del agua subterránea,|y al verme de pronto en esa oscuridad amiga, al amparo de la frescura, ante el silencio del agua subterranea,
fue02-234|me acometió de pronto un miedo que no sentía —estoy seguro—|me acometio de pronto un miedo que no sentia --estoy seguro--
fue02-235|desde cuarenta años atrás miedo infantil de una presencia enemiga y difusa y me eché a llorar,|desde cuarenta anos atras miedo infantil de una presencia enemiga y difusa y me eche a llorar,
fue02-236|a llorar como un loco, a llorar de miedo, allá en un rincón sin rubor alguno.|a llorar como un loco, a llorar de miedo, alla en un rincon sin rubor alguno.
fue02-237|No fue sino muy tarde, cuando al escuchar el derrumbe de un techo, se me ocurrió apuntalar la puerta del sótano.|No fue sino muy tarde, cuando al escuchar el derrumbe de un techo, se me ocurrio apuntalar la puerta del sotano.
fue02-238|Hícelo así con su propia escalera y algunos barrotes de la estantería,|Hicelo asi con su propia escalera y algunos barrotes de la estanteria,
fue02-239|devolviéndome aquella defensa alguna tranquilidad;|devolviendome aquella defensa alguna tranquilidad;
fue02-240|no porque hubiera de salvarme, sino por la benéfica influencia de la acción.|no porque hubiera de salvarme, sino por la benefica influencia de la accion.
fue02-241|Cayendo a cada instante en modorras que entrecortaban funestas pesadillas, pasé las horas.|Cayendo a cada instante en modorras que entrecortaban funestas pesadillas, pase las horas.
fue02-242|Continuamente oía derrumbes allá cerca.|Continuamente oia derrumbes alla cerca.
fue02-243|Había encendido dos lámparas que traje conmigo, para darme valor, pues la cisterna era asaz lóbrega.|Habia encendido dos lamparas que traje conmigo, para darme valor, pues la cisterna era asaz lobrega.
fue02-244|Hasta llegué a comer, bien que sin apetito, los restos de un pastel.|Hasta llegue a comer, bien que sin apetito, los restos de un pastel.
fue02-245|En cambio, bebí mucha agua.|En cambio, bebi mucha agua.
fue02-246|De repente mis lámparas empezaron a amortiguarse, y junto con eso el terror,|De repente mis lamparas empezaron a amortiguarse, y junto con eso el terror,
fue02-247|el terror paralizante esta vez, me asaltó.|el terror paralizante esta vez, me asalto.
fue02-248|Había gastado, sin prevenirlo, toda mi luz, pues no tenía sino aquellas lámparas.|Habia gastado, sin prevenirlo, toda mi luz, pues no tenia sino aquellas lamparas.
fue02-249|No advertí, al descender esa tarde, traerlas todas conmigo.|No adverti, al descender esa tarde, traerlas todas conmigo.
fue02-250|Las luces decrecieron y se apagaron.|Las luces decrecieron y se apagaron.
fue02-251|Entonces advertí que la cisterna empezaba a llenarse con el hedor del incendio.|Entonces adverti que la cisterna empezaba a llenarse con el hedor del incendio.
fue02-252|No quedaba otro remedio que salir;|No quedaba otro remedio que salir;
fue02-253|y luego, todo, todo era preferible a morir asfixiado como una alimaña en su cueva.|y luego, todo, todo era preferible a morir asfixiado como una alimana en su cueva.
fue02-254|A duras penas conseguí alzar la tapa del sótano que los escombros del comedor cubrían…|A duras penas consegui alzar la tapa del sotano que los escombros del comedor cubrian...
fue02-255|… Por segunda vez había cesado la lluvia infernal.|... Por segunda vez habia cesado la lluvia infernal.
fue02-256|Pero la ciudad ya no existía.|Pero la ciudad ya no existia.
fue02-257|Techos, puertas, gran cantidad de muros, todas las torres yacían en ruinas.|Techos, puertas, gran cantidad de muros, todas las torres yacian en ruinas.
fue02-258|El silencio era colosal, un verdadero silencio de catástrofe.|El silencio era colosal, un verdadero silencio de catastrofe.
fue02-259|Cinco o seis grandes humaredas empinaban aún sus penachos;|Cinco o seis grandes humaredas empinaban aun sus penachos;
fue02-260|y bajo el cielo que no se había enturbiado ni un momento,|y bajo el cielo que no se habia enturbiado ni un momento,
fue02-261|un cielo cuya crudeza azul certificaba indiferencias eternas, la pobre ciudad, mi pobre ciudad,|un cielo cuya crudeza azul certificaba indiferencias eternas, la pobre ciudad, mi pobre ciudad,
fue02-262|muerta, muerta para siempre, hedía como un verdadero cadáver.|muerta, muerta para siempre, hedia como un verdadero cadaver.
fue02-263|La singularidad de la situación, lo enorme del fenómeno, y sin duda también el regocijo de haberme salvado,|La singularidad de la situacion, lo enorme del fenomeno, y sin duda tambien el regocijo de haberme salvado,
fue02-264|único entre todos, cohibían mi dolor reemplazándolo por una curiosidad sombría.|unico entre todos, cohibian mi dolor reemplazandolo por una curiosidad sombria.
fue02-265|El arco de mi zaguán había quedado en pie, y asiéndome de las adarajas pude llegar hasta su cima.|El arco de mi zaguan habia quedado en pie, y asiendome de las adarajas pude llegar hasta su cima.
fue02-266|No quedaba un solo resto combustible y aquello se parecía mucho a un escorial volcánico.|No quedaba un solo resto combustible y aquello se parecia mucho a un escorial volcanico.
fue02-267|A trechos, en los parajes que la ceniza no cubría, brillaba con un bermejor de fuego el metal llovido.|A trechos, en los parajes que la ceniza no cubria, brillaba con un bermejor de fuego el metal llovido.
fue02-268|Hacia el lado del desierto resplandecía hasta perderse de vista un arenal de cobre.|Hacia el lado del desierto resplandecia hasta perderse de vista un arenal de cobre.
fue02-269|En las montañas, a la otra margen del lago, las aguas evaporadas de éste condensábanse en una tormenta.|En las montanas, a la otra margen del lago, las aguas evaporadas de este condensabanse en una tormenta.
fue02-270|Eran ellas las que habían mantenido respirable el aire durante el cataclismo.|Eran ellas las que habian mantenido respirable el aire durante el cataclismo.
fue02-271|El sol brillaba inmenso, y aquella soledad empezaba a agobiarme con una honda desolación,|El sol brillaba inmenso, y aquella soledad empezaba a agobiarme con una honda desolacion,
fue02-272|cuando hacia el lado del puerto percibí un bulto que vagaba entre las ruinas.|cuando hacia el lado del puerto percibi un bulto que vagaba entre las ruinas.
fue02-273|Era un hombre, y habíame percibido ciertamente, pues se dirigía a mí.|Era un hombre, y habiame percibido ciertamente, pues se dirigia a mi.
fue02-274|No hicimos ademán alguno de extrañeza cuando llegó, y trepando por el arco vino a sentarse conmigo.|No hicimos ademan alguno de extraneza cuando llego, y trepando por el arco vino a sentarse conmigo.
fue02-275|Tratábase de un piloto, salvado como yo en una bodega, pero apuñaleando a su propietario.|Tratabase de un piloto, salvado como yo en una bodega, pero apunaleando a su propietario.
fue02-276|Acababa de agotársele el agua y por ello salía.|Acababa de agotarsele el agua y por ello salia.
fue02-277|Asegurado a este respecto, empecé a interrogarlo.|Asegurado a este respecto, empece a interrogarlo.
fue02-278|Todos los barcos ardieron, los muelles, los depósitos;|Todos los barcos ardieron, los muelles, los depositos;
fue02-279|y el lago habíase vuelto amargo.|y el lago habiase vuelto amargo.
fue02-280|Aunque advertí que hablábamos en voz baja, no me atreví —ignoro por qué— a levantar la mía.|Aunque adverti que hablabamos en voz baja, no me atrevi --ignoro por que-- a levantar la mia.
fue02-281|Ofrecíle mi bodega, donde quedaban aún dos docenas de jamones, algunos quesos, todo el vino…|Ofrecile mi bodega, donde quedaban aun dos docenas de jamones, algunos quesos, todo el vino...
fue02-282|De repente notamos una polvareda hacia el lado del desierto.|De repente notamos una polvareda hacia el lado del desierto.
fue02-283|La polvareda de una carrera. Alguna partida que enviaban, quizá, en socorro, los compatriotas de Adama o de Seboim.|La polvareda de una carrera. Alguna partida que enviaban, quiza, en socorro, los compatriotas de Adama o de Seboim.
fue02-284|Pronto hubimos de sustituir esta esperanza por un espectáculo tan desolador como peligroso.|Pronto hubimos de sustituir esta esperanza por un espectaculo tan desolador como peligroso.
fue02-285|Era un tropel de leones, las fieras sobrevivientes del desierto,|Era un tropel de leones, las fieras sobrevivientes del desierto,
fue02-286|que acudían a la ciudad como a un oasis, furiosos de sed, enloquecidos de cataclismo.|que acudian a la ciudad como a un oasis, furiosos de sed, enloquecidos de cataclismo.
fue02-287|La sed y no el hambre los enfurecía, pues pasaron junto a nosotros sin advertirnos.|La sed y no el hambre los enfurecia, pues pasaron junto a nosotros sin advertirnos.
fue02-288|Y en qué estado venían.|Y en que estado venian.
fue02-289|Nada como ellos revelaba tan lúgubremente la catástrofe.|Nada como ellos revelaba tan lugubremente la catastrofe.
fue02-290|Pelados como gatos sarnosos, reducida a escasos chicharrones la crin,|Pelados como gatos sarnosos, reducida a escasos chicharrones la crin,
fue02-291|secos los ijares, en una desproporción de cómicos a medio vestir con la fiera cabezota,|secos los ijares, en una desproporcion de comicos a medio vestir con la fiera cabezota,
fue02-292|el rabo agudo y crispado como el de una rata que huye, las garras pustulosas, chorreando sangre|el rabo agudo y crispado como el de una rata que huye, las garras pustulosas, chorreando sangre
fue02-293|—todo aquello decía a las claras sus tres días de horror bajo el azote celeste,|--todo aquello decia a las claras sus tres dias de horror bajo el azote celeste,
fue02-294|al azar de las inseguras cavernas que no habían conseguido ampararlos.|al azar de las inseguras cavernas que no habian conseguido ampararlos.
fue02-295|Rondaban los surtidores secos con un desvarío humano en sus ojos,|Rondaban los surtidores secos con un desvario humano en sus ojos,
fue02-296|y bruscamente reemprendían su carrera en busca de otro depósito, agotado también;|y bruscamente reemprendian su carrera en busca de otro deposito, agotado tambien;
fue02-297|hasta que sentándose por último en torno del postrero, con el calcinado hocico en alto,|hasta que sentandose por ultimo en torno del postrero, con el calcinado hocico en alto,
fue02-298|la mirada vagorosa de desolación y de eternidad, quejándose al cielo, estoy seguro, pusiéronse a rugir.|la mirada vagorosa de desolacion y de eternidad, quejandose al cielo, estoy seguro, pusieronse a rugir.
fue02-299|Ah… nada, ni el cataclismo con sus horrores,|Ah... nada, ni el cataclismo con sus horrores,
fue02-300|ni el clamor de la ciudad moribunda era tan horroroso como ese llanto de bestia sobre las ruinas.|ni el clamor de la ciudad moribunda era tan horroroso como ese llanto de bestia sobre las ruinas.
fue02-301|Aquellos rugidos tenían una evidencia de palabra.|Aquellos rugidos tenian una evidencia de palabra.
fue02-302|Lloraban quién sabe qué dolores de inconciencia y de desierto a alguna divinidad oscura.|Lloraban quien sabe que dolores de inconciencia y de desierto a alguna divinidad oscura.
fue02-303|El alma sucinta de la bestia agregaba a sus terrores de muerte el pavor de lo incomprensible.|El alma sucinta de la bestia agregaba a sus terrores de muerte el pavor de lo incomprensible.
fue02-304|Si todo estaba lo mismo, el sol cotidiano.|Si todo estaba lo mismo, el sol cotidiano.
fue02-305|El cielo eterno, el desierto familiar, ¿por qué se ardían y por qué no había agua…?|El cielo eterno, el desierto familiar, ?por que se ardian y por que no habia agua...?
fue02-306|Y careciendo de toda idea de relación con los fenómenos, su horror era ciego, es decir, más espantoso.|Y careciendo de toda idea de relacion con los fenomenos, su horror era ciego, es decir, mas espantoso.
fue02-307|El trasporte de su dolor elevábalos a cierta vaga noción de provenencia,|El trasporte de su dolor elevabalos a cierta vaga nocion de provenencia,
fue02-308|ante aquel cielo de donde había estado cayendo la lluvia infernal;|ante aquel cielo de donde habia estado cayendo la lluvia infernal;
fue02-309|y sus rugidos preguntaban ciertamente algo a la cosa tremenda que causaba su padecer.|y sus rugidos preguntaban ciertamente algo a la cosa tremenda que causaba su padecer.
fue02-310|Ah… esos rugidos, lo único de grandioso que conservaban aún aquellas fieras disminuidas:|Ah... esos rugidos, lo unico de grandioso que conservaban aun aquellas fieras disminuidas:
fue02-311|cuál comentaban el horrendo secreto de la catástrofe;|cual comentaban el horrendo secreto de la catastrofe;
fue02-312|cómo interpretaban en su dolor irremediable la eterna soledad, el eterno silencio, la eterna sed…|como interpretaban en su dolor irremediable la eterna soledad, el eterno silencio, la eterna sed...
fue02-313|Aquello no debía durar mucho. El metal candente empezó a llover de nuevo, más compacto, más pesado que nunca.|Aquello no debia durar mucho. El metal candente empezo a llover de nuevo, mas compacto, mas pesado que nunca.
fue02-314|En nuestro súbito descenso alcanzamos a ver que las fieras se desbandaban buscando abrigo bajo los escombros.|En nuestro subito descenso alcanzamos a ver que las fieras se desbandaban buscando abrigo bajo los escombros.
fue02-315|Llegamos a la bodega, no sin que nos alcanzaran algunas chispas;|Llegamos a la bodega, no sin que nos alcanzaran algunas chispas;
fue02-316|y comprendiendo que aquel nuevo chaparrón iba a consumar la ruina, me dispuse a concluir.|y comprendiendo que aquel nuevo chaparron iba a consumar la ruina, me dispuse a concluir.
fue02-317|Mientras mi compañero abusaba de la bodega —por primera y última vez, a buen seguro—|Mientras mi companero abusaba de la bodega --por primera y ultima vez, a buen seguro--
fue02-318|decidí aprovechar el agua de la cisterna en mi baño fúnebre;|decidi aprovechar el agua de la cisterna en mi bano funebre;
fue02-319|y después de buscar inútilmente un trozo de jabón,|y despues de buscar inutilmente un trozo de jabon,
fue02-320|descendí a ella por la escalinata que servía para efectuar su limpieza.|descendi a ella por la escalinata que servia para efectuar su limpieza.
fue02-321|Llevaba conmigo el pomo de veneno, que me causaba un gran bienestar,|Llevaba conmigo el pomo de veneno, que me causaba un gran bienestar,
fue02-322|apenas turbado por la curiosidad de la muerte.|apenas turbado por la curiosidad de la muerte.
fue02-323|El agua fresca y la oscuridad me devolvieron a las voluptuosidades de mi existencia de rico|El agua fresca y la oscuridad me devolvieron a las voluptuosidades de mi existencia de rico
fue02-324|que acababa de concluir.|que acababa de concluir.
fue02-325|Hundido hasta el cuello, el regocijo de la limpieza y una dulce impresión de domesticidad acabaron de serenarme.|Hundido hasta el cuello, el regocijo de la limpieza y una dulce impresion de domesticidad acabaron de serenarme.
fue02-326|Oía afuera el huracán de fuego.|Oia afuera el huracan de fuego.
fue02-327|Comenzaban otra vez a caer escombros.|Comenzaban otra vez a caer escombros.
fue02-328|De la bodega no llegaba un solo rumor.|De la bodega no llegaba un solo rumor.
fue02-329|Percibí en eso un reflejo de llamas que entraban por la puerta del sótano, el característico tufo urinoso|Percibi en eso un reflejo de llamas que entraban por la puerta del sotano, el caracteristico tufo urinoso
fue02-330|Llevé el pomo a mis labios, y…|Lleve el pomo a mis labios, y...
mar01001|En marzo de 1808, y cuando habían transcurrido cuatro meses desde que empecé a trabajar en el oficio de cajista, ya componía con mediana destreza, y ganaba tres reales por ciento de líneas en la imprenta del Diario de Madrid.|En marzo de mil ochocientos ocho, y cuando habian transcurrido cuatro meses desde que empece a trabajar en el oficio de cajista, ya componia con mediana destreza, y ganaba tres reales por ciento de lineas en la imprenta del Diario de Madrid.
mar01002|No me parecía muy bien aplicada mi laboriosidad, ni de gran porvenir la carrera tipográfica;|No me parecia muy bien aplicada mi laboriosidad, ni de gran porvenir la carrera tipografica;
mar01003|pues aunque toda ella estriba en el manejo de las letras, más tiene de embrutecedora que de instructiva.|pues aunque toda ella estriba en el manejo de las letras, mas tiene de embrutecedora que de instructiva.
mar01004|Así es, que sin dejar el trabajo ni aflojar mi persistente aplicación, buscaba con el pensamiento horizontes más lejanos y esfera más honrosa que aquella de nuestra limitada, oscura y sofocante imprenta.|Asi es, que sin dejar el trabajo ni aflojar mi persistente aplicacion, buscaba con el pensamiento horizontes mas lejanos y esfera mas honrosa que aquella de nuestra limitada, oscura y sofocante imprenta.
mar01005|Mi vida al principio era tan triste y tan uniforme como aquel oficio, que en sus rudimentos esclaviza la inteligencia sin entretenerla;|Mi vida al principio era tan triste y tan uniforme como aquel oficio, que en sus rudimentos esclaviza la inteligencia sin entretenerla;
mar01006|pero cuando había adquirido alguna práctica en tan fastidiosa manipulación, mi espíritu aprendió a quedarse libre, mientras las veinte y cinco letras, escapándose por entre mis dedos, pasaban de la caja al molde.|pero cuando habia adquirido alguna practica en tan fastidiosa manipulacion, mi espiritu aprendio a quedarse libre, mientras las veinte y cinco letras, escapandose por entre mis dedos, pasaban de la caja al molde.
mar01007|Bastábame, pues, aquella libertad para soportar con paciencia la esclavitud del sótano en que trabajábamos, el fastidio de la composición, y las impertinencias de nuestro regente, un negro y tiznado cíclope, más propio de una herrería que de una imprenta.|Bastabame, pues, aquella libertad para soportar con paciencia la esclavitud del sotano en que trabajabamos, el fastidio de la composicion, y las impertinencias de nuestro regente, un negro y tiznado ciclope, mas propio de una herreria que de una imprenta.
mar01008|Necesito explicarme mejor.|Necesito explicarme mejor.
mar01009|Yo pensaba en la huérfana Inés, y todos los organismos de mi vida espiritual describían sus amplias órbitas alrededor de la imagen de mi discreta amiga, como los mundos subalternos que voltean sin cesar en torno del astro que es base del sistema.|Yo pensaba en la huerfana Ines, y todos los organismos de mi vida espiritual describian sus amplias orbitas alrededor de la imagen de mi discreta amiga, como los mundos subalternos que voltean sin cesar en torno del astro que es base del sistema.
mar01010|Cuando mis compañeros de trabajo hablaban de sus amores o de sus trapicheos, yo, necesitando comunicarme con alguien, les contaba todo sin hacerme de rogar, diciéndoles:|Cuando mis companeros de trabajo hablaban de sus amores o de sus trapicheos, yo, necesitando comunicarme con alguien, les contaba todo sin hacerme de rogar, diciendoles:
mar01011|—Mi amiga está en Aranjuez con su reverendo tío, el padre D.Celestino Santos del Malvar, uno de los mejores latinos que ha echado Dios al mundo.|--Mi amiga esta en Aranjuez con su reverendo tio, el padre D.Celestino Santos del Malvar, uno de los mejores latinos que ha echado Dios al mundo.
mar01012|La infeliz Inés es huérfana y pobre;|La infeliz Ines es huerfana y pobre;
mar01013|pero no por eso dejará de ser mi mujer, con la ayuda de Dios, que hace grandes a los pequeños.|pero no por eso dejara de ser mi mujer, con la ayuda de Dios, que hace grandes a los pequenos.
mar01014|Tiene diez y seis años, es decir, uno menos que yo, y es tan linda, que avergüenza con su carita a todas las rosas del Real Sitio.|Tiene diez y seis anos, es decir, uno menos que yo, y es tan linda, que averguenza con su carita a todas las rosas del Real Sitio.
mar01015|Pero, díganme Vds., señores, ¿qué vale su hermosura comparada con su talento? Inés es un asombro, es un portento;|Pero, diganme Vds., senores, ?que vale su hermosura comparada con su talento? Ines es un asombro, es un portento;
mar01016|Inés vale más que todos los sabios, sin que nadie la haya enseñado nada: todo lo saca de su cabeza, y todo lo aprendió hace cientos de miles de años.|Ines vale mas que todos los sabios, sin que nadie la haya ensenado nada: todo lo saca de su cabeza, y todo lo aprendio hace cientos de miles de anos.
mar01017|Cuando no me ocupaba en estas alabanzas, departía mentalmente con ella.|Cuando no me ocupaba en estas alabanzas, departia mentalmente con ella.
mar01018|En tanto las letras pasaban por mi mano, trocándose de brutal y muda materia en elocuente lenguaje escrito.|En tanto las letras pasaban por mi mano, trocandose de brutal y muda materia en elocuente lenguaje escrito.
mar01019|¡Cuánta animación en aquella masa caótica! En la caja, cada signo parecía representar los elementos de la creación, arrojados aquí y allí, antes de empezar la grande obra.|!Cuanta animacion en aquella masa caotica! En la caja, cada signo parecia representar los elementos de la creacion, arrojados aqui y alli, antes de empezar la grande obra.
mar01020|Poníalos yo en movimiento, y de aquellos pedazos de plomo surgían sílabas, voces, ideas, juicios, frases, oraciones, períodos, párrafos, capítulos, discursos, la palabra humana en toda su majestad;|Ponialos yo en movimiento, y de aquellos pedazos de plomo surgian silabas, voces, ideas, juicios, frases, oraciones, periodos, parrafos, capitulos, discursos, la palabra humana en toda su majestad;
mar01021|y después, cuando el molde había hecho su papel mecánico, mis dedos lo descomponían, distribuyendo las letras:|y despues, cuando el molde habia hecho su papel mecanico, mis dedos lo descomponian, distribuyendo las letras:
mar01022|cada cual se iba a su casilla, como los simples que el químico guarda después de separados;|cada cual se iba a su casilla, como los simples que el quimico guarda despues de separados;
mar01023|los caracteres perdían su sentido, es decir, su alma, y tornando a ser plomo puro, caían mudos e insignificantes en la caja.|los caracteres perdian su sentido, es decir, su alma, y tornando a ser plomo puro, caian mudos e insignificantes en la caja.
mar01024|¡Aquellos pensamientos y este mecanismo todas las horas, todos los días, semana tras semana, mes tras mes! Verdad es que las alegrías, el inefable gozo de los domingos compensaban todas las tristezas y angustiosas cavilaciones de los demás días.|!Aquellos pensamientos y este mecanismo todas las horas, todos los dias, semana tras semana, mes tras mes! Verdad es que las alegrias, el inefable gozo de los domingos compensaban todas las tristezas y angustiosas cavilaciones de los demas dias.
mar01025|¡Ah!, permitid a mi ancianidad que se extasíe con tales recuerdos;|!Ah!, permitid a mi ancianidad que se extasie con tales recuerdos;
mar01026|permitid a esta negra nube que se alboroce y se ilumine traspasada por un rayo de sol.|permitid a esta negra nube que se alboroce y se ilumine traspasada por un rayo de sol.
mar01027|Los sábados eran para mí de una belleza incomparable:|Los sabados eran para mi de una belleza incomparable:
mar01028|su luz me parecía más clara, su ambiente más puro;|su luz me parecia mas clara, su ambiente mas puro;
mar01029|y en tanto ¿quién podía dudar que los rostros de las gentes eran más alegres, y el aspecto de la ciudad más alegre también?|y en tanto ?quien podia dudar que los rostros de las gentes eran mas alegres, y el aspecto de la ciudad mas alegre tambien?
mar01030|Pero la alegría no estaba sino en el alma.|Pero la alegria no estaba sino en el alma.
mar01031|El sábado es el precursor del domingo, y a eso del medio día comenzaban mis preparativos de viaje, de aquel viaje al cielo, que mi imaginación renueva hoy, sesenta y cinco años después.|El sabado es el precursor del domingo, y a eso del medio dia comenzaban mis preparativos de viaje, de aquel viaje al cielo, que mi imaginacion renueva hoy, sesenta y cinco anos despues.
mar01032|Aún me parece que estoy tratando con los trajineros de la calle Angosta de San Bernardo sobre las condiciones del viaje:|Aun me parece que estoy tratando con los trajineros de la calle Angosta de San Bernardo sobre las condiciones del viaje:
mar01033|me ajusto al fin y no puedo menos de disertar un buen rato con ellos acerca de las probabilidades de que tengamos una hermosa noche para la expedición.|me ajusto al fin y no puedo menos de disertar un buen rato con ellos acerca de las probabilidades de que tengamos una hermosa noche para la expedicion.
